{
  "schema_version": 1,
  "gate_version": "v2",
  "skill_id": "regenerative-adaptive-experiment",
  "scanned_at": "2026-09-30",
  "source_revision": "6ef65595ddb23164e602cc8cec77c3f666136f24",
  "artifact_sha256": "4e698fc8c755144202f41d3ec59353370f8cf52dabca4006c2c81b61d434980f",
  "result": "pass",
  "summary": {
    "critical": 0,
    "high": 0,
    "medium": 0,
    "low": 0,
    "info": 0,
    "blocking": 0
  },
  "observed_capabilities": {
    "network_operations": false,
    "process_execution": false,
    "filesystem_writes": false,
    "secret_references": false,
    "destructive_operations": false,
    "lifecycle_hooks": false,
    "encoded_or_obfuscated_content": false
  },
  "findings": [],
  "policy": "Automated findings are evidence for review, not a permanent safety guarantee. Blocking rules stop admission; informational signals remain visible."
}
