{
  "schema_version": 1,
  "gate_version": "v2",
  "skill_id": "regenerative-participatory-decision",
  "scanned_at": "2026-09-30",
  "source_revision": "64c2e06e7feee917096f0f7091bbb51db5da1f97",
  "artifact_sha256": "9946e830454a3a9ad5b23d7a2922fbae35c16856ded13c4d1cbafaf6c1dae7f2",
  "result": "pass",
  "summary": {
    "critical": 0,
    "high": 0,
    "medium": 0,
    "low": 0,
    "info": 0,
    "blocking": 0
  },
  "observed_capabilities": {
    "network_operations": false,
    "process_execution": false,
    "filesystem_writes": false,
    "secret_references": false,
    "destructive_operations": false,
    "lifecycle_hooks": false,
    "encoded_or_obfuscated_content": false
  },
  "findings": [],
  "policy": "Automated findings are evidence for review, not a permanent safety guarantee. Blocking rules stop admission; informational signals remain visible."
}
