{
  "schema_version": 1,
  "gate_version": "v2",
  "skill_id": "openai-agents-sdk-builder",
  "scanned_at": "2026-09-30",
  "source_revision": "64c2e06e7feee917096f0f7091bbb51db5da1f97",
  "artifact_sha256": "6f89c0ee7fca10165214abf08b71c92c7974306724625d53f14aea5dfeb3d515",
  "result": "pass",
  "summary": {
    "critical": 0,
    "high": 0,
    "medium": 0,
    "low": 0,
    "info": 4,
    "blocking": 0
  },
  "observed_capabilities": {
    "network_operations": false,
    "process_execution": false,
    "filesystem_writes": true,
    "secret_references": true,
    "destructive_operations": true,
    "lifecycle_hooks": false,
    "encoded_or_obfuscated_content": false
  },
  "findings": [
    {
      "rule_id": "destructive-reference",
      "family": "destructive-operation",
      "severity": "info",
      "blocking": false,
      "path": "scripts/scaffold_agent.py",
      "line": 14,
      "evidence_sha256": "be262a109369ff4174b4b7a7aa917a83ca99dc94093be7d497384bb8c0f9cee6",
      "message": "Potentially destructive operation reference observed.",
      "disposition": "review"
    },
    {
      "rule_id": "filesystem-write-reference",
      "family": "filesystem-write",
      "severity": "info",
      "blocking": false,
      "path": "scripts/scaffold_agent.py",
      "line": 19,
      "evidence_sha256": "31a8a89c8bb77487b9fed52faf2916fbff03532b7f85a6929cf7e5070a5422f1",
      "message": "Filesystem write reference observed.",
      "disposition": "review"
    },
    {
      "rule_id": "secret-reference",
      "family": "secrets",
      "severity": "info",
      "blocking": false,
      "path": "scripts/scaffold_agent.py",
      "line": 8,
      "evidence_sha256": "1bd0074c9fd82ff86b8a0f167c771b4d5a563c22cb6f364cb2980ef7608f4754",
      "message": "Secret or credential terminology observed.",
      "disposition": "review"
    },
    {
      "rule_id": "secret-reference",
      "family": "secrets",
      "severity": "info",
      "blocking": false,
      "path": "SKILL.md",
      "line": 28,
      "evidence_sha256": "1bd0074c9fd82ff86b8a0f167c771b4d5a563c22cb6f364cb2980ef7608f4754",
      "message": "Secret or credential terminology observed.",
      "disposition": "review"
    }
  ],
  "policy": "Automated findings are evidence for review, not a permanent safety guarantee. Blocking rules stop admission; informational signals remain visible."
}
