{
  "schema_version": 1,
  "gate_version": "v2",
  "skill_id": "regenerative-listening-loop",
  "scanned_at": "2026-10-01",
  "source_revision": "6e565a981c9a3d7dc224cc10b0a992650913bee8",
  "artifact_sha256": "238882d2f228cf5c085cfba9ae504540b783f48d27e855e70f9daaab7141c388",
  "result": "pass",
  "summary": {
    "critical": 0,
    "high": 0,
    "medium": 0,
    "low": 0,
    "info": 0,
    "blocking": 0
  },
  "observed_capabilities": {
    "network_operations": false,
    "process_execution": false,
    "filesystem_writes": false,
    "secret_references": false,
    "destructive_operations": false,
    "lifecycle_hooks": false,
    "encoded_or_obfuscated_content": false
  },
  "findings": [],
  "policy": "Automated findings are evidence for review, not a permanent safety guarantee. Blocking rules stop admission; informational signals remain visible."
}
