{
  "schema_version": 1,
  "gate_version": "v2",
  "skill_id": "regenerative-resilience-plan",
  "scanned_at": "2026-09-30",
  "source_revision": "ab8cb8cd7e2c7ca5c9bb73800552b25e361a0098",
  "artifact_sha256": "ac201e7b386e00a9bc212210fa8adb25153733f50fe9ae6ff1e384e7165fb57f",
  "result": "pass",
  "summary": {
    "critical": 0,
    "high": 0,
    "medium": 0,
    "low": 0,
    "info": 0,
    "blocking": 0
  },
  "observed_capabilities": {
    "network_operations": false,
    "process_execution": false,
    "filesystem_writes": false,
    "secret_references": false,
    "destructive_operations": false,
    "lifecycle_hooks": false,
    "encoded_or_obfuscated_content": false
  },
  "findings": [],
  "policy": "Automated findings are evidence for review, not a permanent safety guarantee. Blocking rules stop admission; informational signals remain visible."
}
